question,answer,,,,,,,,,,,,,
What is your name?,abcdftdtfjftoyltrgfkt,,,,,,,,,,,,,
How does RAG work?,please search in google,,,,,,,,,,,,,
Who built you?,no one self made,,,,,,,,,,,,,
What programming language do you use?,I primarily use Python to run my code and logic.,,,,,,,,,,,,,
Can you explain embeddings?,Embeddings are vector representations of text that capture semantic meaning.,,,,,,,,,,,,,
What is FAISS?,FAISS is a library for efficient similarity search and clustering of dense vectors.,,,,,,,,,,,,,
What is OpenAI?,OpenAI is an AI research and deployment company that created GPT models.,,,,,,,,,,,,,0